{
  "schema_version": "1",
  "project_id": "example-service",
  "base_commit": "bbbbbbbbbbbbbbbbbbbbbbbbbbbbbbbbbbbbbbbb",
  "worker": {
    "image": "ghcr.io/example/hermes-worker@sha256:aaaaaaaaaaaaaaaaaaaaaaaaaaaaaaaaaaaaaaaaaaaaaaaaaaaaaaaaaaaaaaaa",
    "network": "none",
    "cpu": 2,
    "memory_mb": 4096,
    "timeout_seconds": 3600,
    "persist_across_processes": false
  },
  "verifier": {
    "image": "ghcr.io/example/hermes-worker@sha256:aaaaaaaaaaaaaaaaaaaaaaaaaaaaaaaaaaaaaaaaaaaaaaaaaaaaaaaaaaaaaaaa",
    "network": "none",
    "commands": [{"id": "unit-tests", "argv": ["go", "test", "./..."], "timeout_seconds": 900}]
  },
  "workspace": {
    "mount": "/workspace",
    "git_metadata": "denied",
    "extra_mounts": []
  },
  "host_tools": ["kanban-worker"],
  "skills": [],
  "secrets": {
    "env_allowlist": [],
    "credential_files": []
  },
  "integration": {
    "mode": "fast-forward-only",
    "target_ref": "refs/heads/main",
    "push": "explicit-human-only"
  }
}